text,target_word,year,entry_start_year,rank,top_10_words
"Daddy had a bad thing about me, made me financially too independent. You know—pampered me and let me hang too loose",loose,1968,1225.0,3,much|long|loose|loosely|heavily|heavy|many|far|close|closely
"Within thirty seconds, the blips had passed out of radar range",range,1947,1390.0,3,and|sight|range|control|vision|into|view|communication|beam|distance
"The report calls for minimum academic standards, on top of which can be built any pattern of electives, extracurriculars, and vocationals",vocational,1932,1652.0,3,professional|other|vocational|special|the|extra|so|research|specialization|athletics
The swell had gone northeast..sometimes producing better lefts than rights,right,1968,,3,rights|the|right|r|it|they|we|those|on|in
That doesn't bring us any nearer to finding out what is Boris Waberski's strong suit... We haven't a clue,clue,1948,1599.0,3,single|thing|clue|chance|ghost|line|shred|notion|shadow|scrap
Referees are expected to provide objective evaluations of the works they review,review,1975,1573.0,3,are|examine|review|report|study|recommend|present|read|judge|have
The Disney people are hoping..that the born-again mouse will build a new coalition of free-spending children and adults who will rush..to stores that sell Disney-approved.. merchandise,merchandise,1971,1300.0,3,goods|products|merchandise|brands|toys|things|foods|christmas|clothes|food
"Over the past three years I have become interested in music as ambience... To create a distinction between my own experiments in this area and the products of various purveyors of canned music, I have begun using the term Ambient",ambient,1978,1572.0,3,ambience|music|ambient|musical|ambiental|ambiance|of|in|symphonic|radio
I think we may safely consider the mass at 235 as an isotope of uranium,uranium,1939,1790.0,3,lead|mercury|uranium|the|chlorine|thorium|oxygen|hydrogen|nickel|magnesium
"Perl sets up taint checking at compile time, and it effects the entire program for the entirety of its run",run,1941,1475.0,3,length|duration|run|performance|period|time|life|action|presentation|program
Perhaps it was understating it to say it's the 11th hour—for the industry it is very nearly midnight,midnight,1976,,3,the|that|midnight|a|so|noon|in|dead|its|if
"Like other credit reference bureaux, it faced criticism for stockpiling black information rather than white",white,1968,,3,for|giving|white|using|making|distributing|helping|the|attempting|building
Any tampering with the electrically protected windows will flash a similar alarm,alarm,1948,1400.0,3,signal|warning|alarm|light|red|danger|lamp|message|sign|code
"‘You mean Peter Majury?’ ‘ Jawohl ,’ Gayan said and made a Nazi salute",salute,1935,1400.0,3,gesture|sign|salute|bow|of|movement|face|motion|signal|grimace
"The joysticks are worked with their thumbs and they [ sc. the soldiers] can fire a single shot, multi-shot or switch to automatic",automatic,1941,1599.0,4,a|machine|the|automatic|bayonet|rapid|any|their|an|one
She did not want extraordinary steps taken to prolong her life should the illness leave her in any way debilitated or mentally impaired,impaired,1946,1559.0,4,affected|depressed|weakened|impaired|enfeebled|weak|incapacitated|deranged|or|disturbed
"If you're from the North Island,..South Islanders..will tell you that they live on the mainland",mainland,1949,1440.0,4,north|south|other|mainland|wrong|west|island|best|edge|east
"No signs of a stress incontinence could be objectified in the women of group II, even though, according to their own statements, they were not completely continent",continent,1941,1384.0,4,free|relieved|sexually|continent|cured|relaxed|comfortable|unconscious|normal|under
"Another curtain in the proscenium opening is the Safety or Fireproof Curtain, sometimes nicknamed the Iron",iron,1951,,4,asbestos|fire|smoke|iron|slow|stage|drop|steel|green|red
Gains of up to £2 were seen in long gilts and of up to 5 / 8 in shorts,short,1932,,4,long|sows|the|short|young|gilts|small|pigs|yearling|yearlings
They have nowhere to go. This is—how do the Americans say it?—the end of the line,line,1948,,4,world|trail|road|line|rainbow|rope|string|street|earth|season
"She stressed the necessity of using the genuine Arden product. If it fails, she suggests ‘a little enema’ and in stubborn cases, ‘a high colonic",colonic,1948,1906.0,4,enema|injection|one|colonic|blood|rectal|oil|colon|irrigation|ball
"If the machine's trainer accidentally makes occasional mistakes and forces the wrong answer from the machine, the machine can overcome this bad training",training,1959,1440.0,4,influence|effect|habit|training|luck|teaching|impression|start|practice|treatment
Duty of parents to maintain contact with local authorities having their children in care,care,1932,,4,charge|custody|their|care|school|institutions|training|boarding|schools|attendance
‘You okay?’ asked Donovan... ‘I thought you were properly up the creek,creek,1941,1300.0,4,pole|tree|river|creek|line|flue|spout|wind|ladder|hill
"The flawless skin goes, the lovely eyes fade, and she knows she is over the hill",hill,1950,,4,line|border|danger|hill|precipice|age|dead|dividing|threshold|brink
"When a rabbi gets to be around fifty, his chances of getting another job are not so good. He's like over the hill",hill,1950,,4,age|draft|top|hill|fence|fifty|left|dead|old|average
"All transactions between the Fund and members were to be at par, and all transactions in member currencies at rates within an agreed percentage of parity",parity,1945,1572.0,4,par|the|their|parity|gold|face|such|those|market|normal
"Today's specials are..crab fishcakes with a spicy sauce (again, available as a starter or as a main",main,1987,,4,finisher|dessert|finish|main|finale|second|last|wind|final|finishing
"His poems are at odds with the modernist belief that the essential qualities of poetry are irony, ambiguity and paradox",paradox,1939,1533.0,4,obscurity|the|a|paradox|cynicism|sophistication|an|subtlety|satire|confusion
"If a complete translation of the program is prepared before the initiation of its operation the system is a compiler; if the pseudo-code is retranslated each time it is used during operation, the system is an interpreter",interpreter,1954,1384.0,4,operator|adaptor|analyzer|interpreter|indicator|accumulator|opener|automatic|operating|adjuster
"Silicon..can be substituted either on the Ga site, where it becomes a shallow donor, or on the As site, where it is a shallow acceptor",acceptor,1936,1384.0,4,absorber|receiver|recipient|acceptor|depressor|receptor|depression|recess|re|taker
"We seem to need words which will briefly indicate action by two kinds of chemical transmission, due in the one case to some substance like adrenaline, in the other case to a substance like acetylcholine, so that we may distinguish between chemical function and anatomical origin. I suggest the words ‘adrenergic’ and ‘ cholinergic",cholinergic,1934,1934.0,4,acetylenergic|cholineergic|acetoergic|cholinergic|acetylergic|acetylcholic|chologenic|acetolergic|choline|acetenergic
"‘Don't tell me we're there already.’.. ‘Yes, this is the end of the line",line,1948,,4,world|journey|road|line|first|street|tunnel|trip|drive|earth
"Now a kidney specialist living in St. John's, Newfoundland, he is the driving force behind the extraordinary success of rugby on ‘The Rock",rock,1978,,4,island|ancient|old|rock|coast|isle|new|labrador|newfoundland|narrows
An East Staffordshire pub is being used as a centerpiece of a campaign to get more people to go out and drink at their local,local,1934,1425.0,4,own|homes|favorite|local|clubs|leisure|home|places|regular|work
A ‘vector property’ of a sediment..emphasizes the direction (in a compass sense as an angle from the north point or from some arbitrary reference,reference,1952,1579.0,4,direction|line|zero|reference|point|meridian|initial|origin|standard|north
"Marijuana..when brewed with hot water,..is called ‘ tea",tea,1935,1655.0,4,tequila|mescal|pulque|tea|mexican|the|tizwin|chicha|by|hop
"The Arthur Ford Academy defines the word [ sc. medium] in this way: ‘A highly ethical person who causes himself to become a conscious, spiritual and psychic channel",channel,1976,1387.0,4,instrument|medium|force|channel|entity|being|center|agent|personality|vehicle
"‘Did you say something, man?’ the face asked. I took a deep breath..and then I address the face. ‘Not a thing, brother,’ I reply, ‘not a thing. Be my guest",guest,1955,,4,friend|brother|witness|guest|good|guide|partner|little|companion|own
Brovak decided against hasty action. The correct approach was not to ask this fruit fly whether he preferred to pitch or catch,catch,1967,1225.0,4,to|bat|be|catch|bunt|drop|throw|curve|field|not
Miss Bach had been talking wistfully of taking up the wagon-trail life of a West Bank settler,settler,1967,1598.0,5,missionary|farmer|rancher|woman|settler|indian|teacher|ranch|family|homesteader
"A new branch of systemic linguistics dealing with the types of relation that arise in use between tongues, and between them and their users... As its aim is to confront tongues and communities as social institutions, it might be called Institutional",institutional,1958,1617.0,5,social|sociological|the|sociology|institutional|sociologic|socio|a|systemic|socialistic
The DO statement automatically causes execution of all the statements following it up to and including the statement labelled n for values of i from m 1 in steps of m 3 ... The counter i is sometimes referred to as the index,index,1957,1398.0,5,counter|i|first|n|index|zero|m|statement|indicator|key
"In the older ‘dips’ and also in modern ‘sheep showers’, this is an adjoining draining pen to which sheep go after treatment with the ‘ wash",wash,1933,1440.0,5,dip|dips|shower|sheep|wash|bath|dipping|lick|liquor|fly
"The nation that was diddy-bopping along on speed at the time knew them by their street names: Black Beauties, Big Cross-ops and Little Whites",white,1967,,5,cross|crossops|black|red|white|brown|ones|beauties|blue|pink
Six hours of trying to get the program to run,run,1959,,5,work|the|working|go|run|running|start|move|going|a
Doctors starting their careers..had few patients on their lists,list,1949,1604.0,5,lists|hands|books|first|list|waiting|visiting|own|calling|arrival
A male model visiting from Tokyo nurses a beer and surveys the transvestites around him. ‘This is a really wild scene,scene,1950,1481.0,5,party|picture|and|night|scene|one|evening|piece|model|moment
What seems to emerge from the encounter of historical materialism with the two anthropological structuralisms is a distinction between the West and the rest,rest,1932,1440.0,5,east|orient|south|far|rest|bast|middle|fast|near|hast
My father had his legs blown off..when he tried to flee over the Wall,wall,1961,,5,top|roof|bridge|parapet|wall|fence|border|hills|german|river
"The English supporters came up with a soccer style chant: ‘Fat boy, fat boy. You ate all our pies",pie,1992,1301.0,5,meat|fat|food|beans|pie|bread|beef|cheese|soap|grub
"Originally, the US attempted to prevent the use of strong encryption by foreign governments. The export of the technology was prevented under US laws that classed it as a munition",munition,1962,1448.0,5,military|war|secret|commodity|munition|contraband|public|form|monopoly|dangerous
Such a plan will not answer the big questions of whose finger will be on the button,button,1949,1330.0,5,trigger|pulse|throttle|public|button|safety|money|financial|national|key
"I kept on schedule with the work, but I couldn't with the money. Each week, I'd be just a little over the line",line,1934,,5,amount|top|limit|week|line|previous|mark|budget|allowance|preceding
"Access to specific pieces of information is far faster on a compact, rapidly spinning disk than on a long ribbon of tape",tape,1932,,5,paper|film|a|information|tape|cards|card|record|records|celluloid
"(Qu. GG12, To have an inner feeling that something is about to happen: ‘There she comes now, I —— she would’. ) Inf [ormant] s.., Had a (good) mind",mind,1966,,5,feeling|idea|impression|deal|mind|or|time|dream|notion|many
"Emotionality-stability seems indissolubly linked with the autonomic nervous system, which regulates the expression of the emotions, and which in turn is organized and governed by the ‘ visceral",visceral,1949,1575.0,5,vegetative|sympathetic|autonomic|endocrine|visceral|great|brain|higher|affective|endocrines
When I am an old woman I shall wear purple With a red hat which doesn't go,go,1940,,5,fit|match|suit|become|go|need|show|look|matter|come
"Just sit down opposite the hatch and contemplate your new shipmates as, one by one, they troop on the ‘ upper",upper,1938,1789.0,5,poop|quarter|deck|bridge|upper|main|gangway|fo|stage|lower
It'll take more than one simple announcement..to pre-sell six months of product through the trades,trade,1949,1450.0,5,medium|advertising|columns|pages|trade|one|most|right|newspapers|same
"The kids had to do their homework, and I didn't think this was a night I could ask Ciana to sit",sit,1954,,6,go|stay|come|do|help|sit|leave|take|be|work
Even therapists with the best credentials can be all over the map,map,1956,1527.0,6,place|country|world|lot|shop|map|wrong|united|house|field
"The singer with the outfit can do with his or her voice just what the soloist can do with his instrument, he can give",give,1936,,6,make|play|produce|bring|sing|give|get|do|vary|put
She hasn't been able to sleep. She's worried sick,sick,1952,,6,about|to|over|because|herself|sick|and|so|a|for
"When ultra-violet light acts on a mixture of water, carbon dioxide, and ammonia, a vast variety of organic substances are made... Before the origin of life they must have accumulated till the primitive oceans reached the consistency of hot dilute soup",soup,1956,1325.0,6,solutions|glue|mud|syrup|jelly|soup|gelatine|mucilage|milk|soap
"By the Revolution of 1917 they [ sc. the Bolsheviks] began to erect a ‘superstructure’ for which, at least in Central Russia, no corresponding ‘ base",base,1933,1335.0,6,foundation|foundations|basis|substructure|founda|base|basement|subsoil|understructure|structure
Early as it is women and old men are hunting for scraps of coal on the side of the incline. They have to be away before the police start to round,round,1941,1400.0,6,clear|work|patrol|drive|search|round|make|clean|look|gather
The first hundred thousand mark is about to be reached in..television licences..compared with the 11 m. for sound,sound,1949,1297.0,6,the|broadcasting|wireless|radio|broadcast|sound|which|last|all|television
The 280 tube has two cathodes and two anodes and so is essentially two half-wave rectifiers enclosed in one envelope,envelope,1932,1707.0,6,bulb|tube|glass|case|container|envelope|casing|evacuated|housing|box
"The units under his control would suddenly stop purchases from some privately-owned ancillaries ... Krishnamurthy would then..ask his sons to negotiate to buy up these units. And before you knew it, the dried-up orders would start coming again to the ancillary",ancillary,1963,1663.0,6,private|privately|ancillaries|subsidiaries|mills|ancillary|factories|manufacturers|same|firms
"Carter, in Keep a Song in Your Soul ,..fashioned one of the great arrangements in the Henderson book",book,1939,,6,catalog|catalogue|collection|series|list|book|program|repertoire|library|song
"‘He's always at the outer edge of the rulebook anyway,’ says Eric Nesberenko of the Chicago Black Hawks, who has played frequently against Howe man-on-man",man,1963,,6,the|defense|ice|his|skates|man|your|defence|a|and
The quantity is as high as the quality: 1998 really is an outstanding year,year,1934,,6,number|value|collection|achievement|record|year|picture|production|lot|offering
In the Midwest (especially the Ohio Valley) a sweet pepper is called a ‘ mango,mango,1948,1582.0,6,hot|sweet|bell|bird|chile|mango|pimento|sugar|chili|red
The SIM Lock can be deactivated to allow a customer to switch to another network or service provider..but operators often charge a significant fee before they provide the information necessary to unlock,unlock,1996,1400.0,6,make|do|effect|switch|accomplish|unlock|change|the|such|get
The enemy would have to expend ‘many times more megatonnage’ on such hard targets than on a soft,soft,1958,,6,fleet|target|single|ship|few|soft|modern|battleship|squadron|moving
"It was a Saturday morning, when many go into the city centre to do their weekly ‘big shop",shop,1960,,6,shopping|buying|business|market|marketing|shop|trading|purchasing|markets|buy
"Do you finesse, or do you play the ace hoping the king will drop",drop,1933,,7,fall|win|be|make|take|come|drop|follow|not|cover
It is common to talk about trees using terms borrowed from genealogy. Branches directly connect parents with children,child,1984,,7,offspring|children|their|the|progeny|descendants|child|posterity|grandparents|a
A typical electronic mail system now provides..an alerting mechanism to tell the user that he has new mail in his mailbox,mailbox,1971,1810.0,7,box|mail|office|locker|home|post|mailbox|letter|possession|hands
Donaldson..had thought of being a London taxi driver and had gone so far as to ride round on a bicycle to acquire the ‘ Knowledge,knowledge,1936,,7,necessary|hang|feel|proper|london|knack|knowledge|requisite|right|touch
"NBC made a deal with the studio to make a few two-hour ‘Buck Rogers’ movies, to be shown occasionally as specials",special,1952,1225.0,7,a|part|an|the|prologues|features|special|short|added|road
It sounded like they were all striving to create..but it didn't really happen,happen,1949,1385.0,7,sound|matter|seem|mean|make|amount|happen|come|get|do
I can't walk down a corridor without someone saying something. Fatty Day. Fat Slag. Who ate all the pies,pie,1992,1301.0,7,ice|apples|eggs|soup|candy|cheese|pie|chicken|peanuts|bread
I'm in trouble. I'm going to have a baby... I've had it. Good and proper. I'm up the creek,creek,1941,1300.0,7,spout|river|hill|tree|street|pole|creek|flue|road|line
"A red quark and a blue quark can mutually attract, and the attraction is maximised if in turn they cluster with a yellow",yellow,1975,,7,red|third|common|blue|white|like|yellow|green|similar|black
"The units of grammar form a hierarchy... The relation among the units, then, is that..each ‘consists of’ one, or of more than one, of the unit next below... The scale on which the units are in fact ranged..may be called ‘ rank",rank,1954,1325.0,7,the|hierarchy|order|their|degree|hierarchical|rank|a|grammatical|grammar
"The next two fugues are tours de force , being compositions that can be inverted note for note from beginning to end. For purposes of comparison Bach writes his Inversus under his Rectus",rectus,1931,1615.0,7,own|directus|original|reversus|versus|primus|rectus|authenticus|verus|direct
"Of the six or more species which have acquired the brooding habit, only the Indian python is now known on good evidence to be a true incubator",incubator,1969,1851.0,7,brooder|mother|python|nest|parasite|snake|incubator|incubating|egg|foster
"Things..wouldn't always get past the sharp-eyed QC. If a case smelt, he would smell",smell,1939,1175.0,7,say|get|ask|have|make|find|smell|go|not|send
"Barley..got his name and address out of him, against every known canon of the trade",trade,1966,1450.0,8,game|law|detective|police|art|craft|profession|trade|criminal|service
I've always believed that there's nothing which can better half-an-hour in the middle,middle,1958,,8,country|evening|company|life|train|morning|day|middle|world|open
A single eight-ounce serving of plain low-fat yoghurt will give you over half of your daily calcium allowance,allowance,1931,1325.0,8,requirement|requirements|and|needs|intake|need|quota|allowance|content|supply
The Storm troops wrested from the Communist and Socialist crowds their dominance of the street,street,1931,,8,city|streets|town|central|great|municipal|situation|street|public|principal
"[He] looked after her, and Harry grinned at him. ‘Not bad, eh?’ he said... ‘That's a bit of the local talent",talent,1947,,8,colour|color|atmosphere|colouring|stuff|style|idiom|talent|flavour|manner
The other semi-final was disappointing. Roscoe Tanner..had upset Bjorn Borg in the quarters,quarter,1950,1300.0,8,first|morning|semi|second|third|other|national|quarter|afternoon|opening
The carpenters end with a march down-stage with stiff mallet-wielding arms pistoning up in the Nazi salute,salute,1935,1400.0,8,manner|tempo|style|fashion|rhythm|air|hymn|salute|spirit|way
"‘What did you get on the other cokies?’ ‘This fellow was lousy with it,’ replied Erb... ‘The other one is clean",clean,1953,,8,all|a|still|dead|the|in|not|clean|just|on
"I'm constantly on the phone, but meeting famous celebs keeps me on a high",high,1944,,8,constant|jump|strain|steady|higher|keen|hop|high|perpetual|nervous
"In a long molecule many different permutations are possible, and it therefore seems likely that the precise sequence of the bases is the code which carries the genetical information",information,1937,1387.0,8,significance|message|factors|effect|pattern|factor|impulse|information|characters|formula
We might regard liquid helium as if it consisted of a ‘mixture’ of two liquids—one is ‘superfluid’ without viscosity..and the other is ‘ normal,normal,1941,1598.0,9,viscous|fluid|underfluid|ordinary|subfluid|superfluid|fluorescent|infrafluid|normal|liquid
"I'm diggin a lot of Armstrong, 'cause he's the man",man,1952,,9,best|only|biggest|boss|one|most|kind|feller|man|strongest
The Blattnerphone is an invention for recording magnetically upon steel tape,tape,1932,,9,wire|the|discs|or|bars|bands|needles|cylinders|tape|wires
The bet that [they] ..made at the time was that smartphones are going to be a thing,thing,2000,,9,big|great|success|failure|good|very|lot|drug|thing|complete
"Harlem..is where the white man is no longer the ‘ofay’ but ‘Mr. Charlie’ or ‘the man’, and mostly ‘whitey’, derived from the Black Nationalist talk of ‘the blue-eyed white devil",devil,1938,,9,man|men|slave|people|race|trash|brother|foreigner|devil|boy
Having been to all the Champions League home games and four aways,away,1935,,9,of|out|games|or|others|in|abroad|outside|away|at
"She..had had him, and one, Culpepper, in her room up to all hours",hour,1931,1250.0,9,hours|sorts|manner|the|kinds|night|hoars|bours|hour|times
Greater numbers of adventurous North Islanders than ever before have crossed the seas this summer to the ‘ mainland,mainland,1949,1440.0,9,land|old|states|antipodes|britain|sunny|other|big|mainland|main
"Thumbstyle playing usually sounds best with a scooped tone, where the lows..and highs..are boosted while the mids",mid,1948,,9,middle|middles|medium|center|intermediate|bass|centre|intermediates|mid|mediums
"We must not, therefore, here look for that consecutive arrangement and symmetry which we might be entitled to expect in a similar work upon the resources of a more developed",developed,1949,1656.0,10,advanced|civilized|favoured|highly|settled|homogeneous|modern|civilised|ancient|developed
"She thinks they just make money, but let me tell you, she's the one, is she ever",ever,1934,,10,not|who|that|now|the|a|to|really|in|ever
Chris said some guys in the locker room razzed him when they first learned of his abstinence pledge,pledge,1993,1348.0,10,from|and|but|in|on|at|act|for|program|pledge
I don't want heartbreak for Dotty. For Dotty I want a— life,life,1980,,10,a|well|what|husband|i|home|oh|happy|different|life
I was tall and weighed ninety-five pounds. And that's thin. I had no figure; I was a stick,stick,1945,,10,mere|little|bundle|bag|scarecrow|skinny|skeleton|caricature|plain|stick
The individual customer must generally have his material fabricated to his order and cannot obtain material [aluminium] ‘ off the shelf,shelf,1936,1405.0,10,reel|bat|works|premises|bar|chain|bars|shop|hat|shelf
How good is the lens on your camera? Is it a bit soft,soft,1945,,10,of|better|too|old|out|hazy|off|under|slow|soft
"I met her once at the hairdresser's bewailing that she couldn't afford a nice steak for Herbert on their income, and she had obviously spent the price of it on a ‘ set",set,1933,1330.0,10,new|permanent|coiffure|special|transformation|marcel|nice|hair|bob|set
"The Brits, as we know, conquered the world with history's best navy, implanted their colonies and painted the map pink",pink,1960,1566.0,10,of|red|with|a|in|from|green|crimson|yellow|pink
I asked the oil people to supply the..necessary facts and figures. They keep promising to do it but according to the solicitors they don't furnish them. The result is that we have been running around in circles,circle,1933,,10,circles|a|the|search|this|an|our|washington|all|circle
"In 1792, the United States became the first country deliberately to change to decimal",decimal,1967,1608.0,10,a|the|an|gold|paper|free|peace|silver|this|decimal
‘Orphan drugs’—medicines that aren't used in sufficient quantities to justify the cost of bringing them to the market,market,1975,,10,store|hospital|dispensary|front|united|drug|warehouse|patient|coast|market
"Daughter , young homosexual male, especially one introduced into homosexual society by a mother",mother,1947,,10,woman|female|father|man|male|teacher|girl|friend|young|mother
"‘Okay, Jay,’ Joe finally said, from behind the camera and lights and sound equipment. ‘Let her roll",roll,1935,1325.0,10,go|ride|rip|run|come|fly|flicker|slide|loose|roll
A quark and an antiquark in a meson must be of a color and the corresponding anticolor and will consequently neutralize to white,white,1974,,10,a|the|form|produce|make|some|give|an|each|white
The newest type of moves.. [are] smooth controlled airs,air,1984,1225.0,10,and|by|movements|in|with|machines|power|movement|motion|air
