text,target_word,year,entry_start_year,rank,top_10_words
"Lorry drivers..regarded this instrument [ sc. the tachograph] as a spy which recorded everything they did, including going for a smoke, pulling into a layby and ‘ doing the necessary",necessary,1935,1376.0,11,old|time|wind|eyes|eye|baby|house|town|usual|dog
"Deep penetration must not be aimed at for a number of sessions, and when the woman is ready for it she will move her body in such a way that the penis will penetrate",penetrate,1953,1530.0,11,be|not|enter|come|fall|find|have|follow|strike|slip
"Nini was sporting a new Balenciaga creation of heavy white lace that hung in a loose, formless tunic",tunic,1955,,11,mass|drapery|wrap|way|cascade|fashion|sort|train|manner|garment
"A galaxy might have a jet of gas sticking out, for example, or be wrapped with extra dust. These galaxies are labelled ( pec ), for peculiar",peculiar,1936,1449.0,11,they|the|example|which|their|a|it|there|we|some
"If my wife saw me wearing one, she would tear me off a strip",strip,1940,1459.0,11,piece|limb|button|dozen|leg|bit|whole|la|lock|hundred
"Orbiting the globe, these American spy satellites peer from space to snap pictures of Iraqi missile sites and listen to Lebanese terrorists' telephone chatter",chatter,1995,1275.0,11,conversations|calls|conversation|numbers|messages|voices|talk|warnings|talks|orders
An ‘extended’ position can look beautiful with dancers of the jarreté type who are loose enough to sustain such a position without straining too noticeably and are therefore said to have a good ‘ extension,extension,1934,1400.0,11,jarreté|balance|carriage|figure|leg|jarret|back|foundation|position|swing
"For an element of the mass [ formula follows ] certain states in which the neutrons are in the doublet, the protons in the triplet state, exactly coincides [ sic ] in approximation (1) with a state in which the neutrons are in the quartet, the protons in the singlet",singlet,1937,1763.0,11,quintet|doublet|triplet|octet|sextet|quintuple|single|sextuple|quintuplet|septet
"The relaying of the Empire station by overseas transmitters cannot for various reasons be assumed to be possible as a regular practice and therefore the recording of programmes on gramophone discs becomes an important subsidiary method of programme circulation... American programmes are already circulated by this method, which is termed ‘electrical transcription",transcription,1932,1598.0,11,pick|pickup|broadcasting|recording|relay|re|reproduction|record|transmission|gramophone
I showed Mr. Fosburgh the Winslow Homer painting and I think he was as amazed as I am that it should have so precipitously and happily dropped into our laps,lap,1962,,11,hands|possession|collection|midst|family|gallery|lives|museum|house|keeping
Political commercials that explicitly advocated for the support or defeat of a candidate..had to be paid for with hard,hard,1972,,12,advertising|cash|money|the|a|space|an|political|regular|real
The first British fishermen were forbidden by law to settle on what many current residents affectionately call The Rock,rock,1978,,12,island|shore|banks|isle|coast|old|land|neck|green|cape
"As our daily schedules become even more inconsistent, restaurants are finally learning to adapt",adapt,1942,1531.0,12,serve|make|charge|cater|give|meet|take|keep|provide|prepare
He had been given the contract to kill the son of a rival mobster and was being considered for membership in the family,family,1954,1388.0,12,order|organization|club|mob|society|band|secret|gang|union|trust
In the visual arts the Walker Art Centre houses a world-famous collection of moderns,modern,1959,1485.0,12,paintings|prints|drawings|the|etchings|pictures|japanese|works|old|chinese
Spencer..made over 70 first team appearances for the Imps before moving to Millmoor on a free,free,1976,,12,transfer|trade|regular|first|promotion|permanent|farm|scholarship|business|second
"A group of Labour MPs had..written to The Times complaining that my questions to Mr. Foulkes, in the BBC programme Panorama , about specific..allegations of malpractice in his union amounted to public trial",trial,1960,1526.0,12,slander|defamation|libel|incitement|cross|insult|accusations|abuse|charges|criticism
"A finite sequence of zero or more (occurrences of) the letters, we call a word",word,1936,,12,series|finite|sequence|cycle|row|zero|perfect|complete|group|period
"When it came to attic or garret..this same informant reported that common terms were the up-the-stairs, the overhead",overhead,1949,,12,up|down|upstairs|top|over|upper|garret|back|attic|stairs
"In case of a serious hydraulic misfunction, a kill switch on the collective can instantly revert the controls to manual",manual,1964,1406.0,12,the|normal|a|their|emergency|an|full|any|zero|hand
After multiple bad experiences..the vast majority [of customers] do not fill out a survey or complain—they just walk,walk,1976,,12,quit|stay|go|stop|cancel|pay|move|forget|buy|let
"The ‘Night Guard’ luminaire is turned on automatically at dusk and switched off automatically at dawn, providing night-long security",security,1941,1425.0,12,illumination|protection|light|daylight|lighting|service|and|safety|artificial|darkness
The science of seating diplomatic guests in such a manner as to avoid enraging them is called the science of ‘ placement,placement,1939,1795.0,12,seating|the|diplomatic|placing|precedence|social|balance|international|seats|tact
The transistor..consists of three electrodes... The third is a large area low resistance contact on the base,base,1948,1335.0,13,back|patient|abdomen|skin|body|bottom|front|lower|outside|side
"Millions upon millions of Asians, Africans, and Latin Americans are aware that the world today is not divided into whites, blacks, yellows, and browns",brown,1965,1300.0,13,reds|browns|indians|so|red|whites|the|greys|greens|other
"I..would walk up and..ask the bartender: ‘Say, have you seen so-and-so yet?’ I says: ‘Man, I'm sick",sick,1951,,13,the|a|going|looking|not|so|surprised|just|in|afraid
For once the boys didn't have a ‘winner’. For once they admitted here was a fight too close to call,call,1932,,13,be|pick|figure|predict|make|decide|guess|win|give|bet
Tensions had been simmering at the Category C prison since governor David Sherword withdrew inmates' privileges,privilege,1954,,13,privileges|rights|liberties|control|right|complaints|food|representation|self|freedom
"O þe r [in line] 2 and þe t [in line] 26 at least ‘kiss’, if they do not ‘ bite",bite,1957,,13,kiss|embrace|kill|touch|kist|kisse|catch|meet|make|love
"I have been..extraordinarily influenced by what I see in S/M communities, especially around HIV, around safer sex, around gender, around sexual play and who tops and who bottoms",bottom,1981,1544.0,13,is|bottoms|follows|does|tops|leads|rules|under|plays|takes
"His script keeps the focus so lean and tight, it's barely out of breath by the time the credits roll",roll,1952,1325.0,13,are|come|have|show|arrive|get|and|go|reach|begin
"On the lip of an overhang which has no footholds immediately below... You jockey one boot up the rock, pressing on the flat face, then throw a knee over the edge of the ‘ roof",roof,1963,,13,overhang|lip|over|bench|rock|ledge|overhanging|hanging|shelf|wall
"The arrangement of the principal valleys, in most of which are considerable lakes, is distinctly radial",radial,1931,1570.0,13,shown|indicated|seen|traceable|marked|due|connected|parallel|related|in
All follow to the Ace and King of hearts but the Queen does not drop,drop,1933,,13,follow|fall|play|cover|take|win|lead|make|come|appear
Blood was collected..in a mixture of 1% sodium ethylenediamine tetra-acetic acid and 5% dextran..and allowed to sediment,sediment,1934,1859.0,13,stand|remain|clot|coagulate|set|settle|incubate|flow|react|dry
Lisa lacked focus. She was all over the map,map,1956,1527.0,14,place|room|shop|stage|house|studio|world|picture|garden|field
"Transponder , the unit in the IFF system which receives the challenge and automatically transmits the reply",reply,1945,1560.0,14,challenge|signal|message|same|impulse|order|call|energy|answer|number
It is unfair for the Administration and the hawks to try to compromise the patriotism of the doves,dove,1962,1200.0,14,farmers|american|farmer|people|honest|men|birds|great|eagle|country
Routines for solving standard problems will be established on tape and stored in a ‘ library,library,1950,1374.0,14,central|master|standard|tape|reserve|tickler|permanent|perpetual|cabinet|ticker
"The good sea fisherman should be able..to do everything for himself;..manage his own boat, put her on to the marks",mark,1965,,14,beach|right|ground|wind|rocks|bank|fishing|best|proper|shore
"We might start by having some sort of social. Nothing elaborate, you know. Just perhaps all the ladies could bring a plate",plate,1935,1275.0,14,little|cake|pie|few|basket|piece|dish|box|cup|bit
The potentiometer reading is used in the normal way to find its new potential relative to the reference,reference,1952,1579.0,14,standard|earth|cell|battery|point|galvanometer|other|grid|new|first
"Parents brazened out their children's tantrums with the key-phase of, ‘ You wait",wait,1938,1200.0,15,must|can|should|were|see|are|know|ought|never|just
I can have a word with her and tell her to mind her step,step,1934,,15,own|business|eye|p|manners|eyes|work|mother|book|behaviour
His shorts were a bit creased and she wanted to get out her trusty travel iron..and give them a quick press,press,1932,,15,iron|massage|and|crease|pressing|pat|run|rub|ironing|stretch
"Machines can readily share all of their accumulated knowledge, so only one machine has to do the learning",learning,1950,,15,work|thinking|whole|job|same|entire|planning|teaching|trick|experimenting
Is anything indeed to be gained from hunting for some notion embodying the cumulate surface exponency of..transitive and perfective..? It is all too easy at times to chase our conceptual tail,tail,1963,,15,will|game|hares|hounds|quarry|fox|foxes|rabbits|hare|shadows
"There now, I clean forgot. I'm getting silly as a two-bob watch",watch,1954,,15,doll|old|cat|novel|kid|hen|book|kitten|baby|piece
Band and yell leaders to perform; Harvesters have good chance to win state,state,1941,1225.0,15,the|cup|this|if|game|in|championship|a|first|by
"As CAMAC equipment is often sold as individual products to system builders, items are often available either ‘ off the shelf",shelf,1936,1405.0,15,line|floor|reel|hook|list|bat|lot|stock|board|run
"Their writing mainly concerns the street life—the pimp, the junky, the forces of drug addiction, exploitation at the hands of ‘the man",man,1942,,15,police|law|underworld|powers|gang|big|bulls|chinese|strong|white
"Lord, it's my mortar lance corporal. If he breaks we'll be right up the creek",creek,1941,1300.0,15,line|hill|front|road|river|street|beach|ladder|trench|bank
"The table..can be called a stimulus for our perception of a table;..the excitations to which the light rays coming from the table give rise are called the stimuli for our perception. Let us call the first the distant stimulus, the second the proximal",proximal,1935,1727.0,15,near|immediate|present|close|proximate|nearer|table|distant|nearby|local
Many of the fission products formed in a nuclear reactor are themselves strong neutron absorbers (i.e. ‘ poisons,poison,1952,1225.0,15,positive|receptors|negative|strong|acid|active|nuclear|nuclei|nucleus|weak
I have never met such a case of diverse colours meeting without a hint of clash,clash,1935,1522.0,15,discord|the|a|incongruity|transition|their|discordance|confusion|any|conflict
"Owing to a ‘mistake’, Bernadette was probably ‘caught’. She was beginning to ‘ show",show,1936,,15,feel|get|know|play|grow|see|make|lose|understand|think
"The BBC boosts its wares quite as unremittingly, if more quietly, than the other side",side,1961,,15,two|advertisers|concerns|agencies|organizations|advertising|publicity|great|companies|big
It can carry from 267 to 298 passengers at 34-inch seat pitch,pitch,1967,1382.0,16,spacing|space|width|distance|centers|height|intervals|distances|and|per
"As if India were not already finding batting hard enough, the crowd started during this final session to behave as they have seen others doing in Mexico, and performing what is apparently called the ‘ human wave",wave,1984,1526.0,16,snake|fly|touch|kick|crab|chain|monkey|interest|bull|bomb
In Am [erican] E [nglish] ..compounds are usually written solid as soon as they have gained some permanent status; otherwise they are written open,open,1961,,16,with|as|separately|separate|hyphened|in|hyphenated|solid|apart|separated
"Rhythm and blues collectors tend to attach the greatest value to the slow, sweetly romantic ballad",ballad,1944,1458.0,16,tunes|songs|type|numbers|pieces|melodies|and|ballads|blues|or
Specimens may often have to be stored for considerable periods before they can be set to form part of the permanent collection. The usual method of storing such specimens is to ‘ paper,paper,1937,1594.0,16,pin|dry|fix|kill|pack|set|relax|box|lay|bottle
When we hired a car in California we found that a car..bristles with surprises. You..find the spare wheel in the trunk,trunk,1931,1440.0,17,front|back|rear|tonneau|middle|car|most|place|luggage|top
"‘How are you, Jack?’ he asked. ‘I'm grand.’ ‘I saw your picture in the paper,’ said the postman. ‘You looked mighty",mighty,1950,,17,fine|very|as|like|just|a|so|all|awful|grand
"He would crouch over his plate..and glare down at the harmless egg and inoffensive bacon enunciating, as though it were part of some barbarous and sadistic ritual, the words, ‘I'll murder",murder,1935,1175.0,17,eat|kill|have|get|be|never|take|make|do|see
"Unlike cartoon strips, editorial cartoons are most frequently depicted in a single frame",frame,1932,1175.0,17,column|scene|picture|figure|line|drawing|illustration|panel|sheet|large
"Olympus vouchers come in denominations of £5 and £10 and are presented in a complimentary wallet. All their vouchers are security numbered and orders over £5,000 are sent by courier",courier,1980,1382.0,17,registered|cable|special|mail|wire|the|telegraph|air|a|letter
"If the throttle is closed completely the adjustment of the idling mixture is rendered too sensitive, hence it is usual to give a very small opening of the throttle when adjusting the idle",idle,1939,,17,mixture|idling|air|carburetor|fuel|setting|carbureter|position|engine|needle
"Across the street under the low-rise apartment buildings, the young whiteys were drinking beer and macking while they listened to WABC radio",radio,1935,1907.0,18,and|on|broadcasting|or|with|in|broadcast|come|over|as
"This view does as much violence to the time spirit of the Old Testament as its opposite, the Traditionalist standpoint, and both are to be avoided in a just presentation",presentation,1932,1325.0,18,interpretation|and|estimate|appreciation|exegesis|view|conception|evaluation|understanding|criticism
"Since the ‘holes’ behave in many ways like positive electrons, this question can be settled by measuring any quantity which depends on the first power of the charge of the carrier",carrier,1939,1395.0,18,hole|particle|holes|electron|electrons|ion|particles|nucleus|ions|body
I didn't really know what was going on after I'd had the baby... I was pleased as I was already a week-and-a-half overdue,overdue,1939,1805.0,18,old|mother|married|older|wife|bride|with|pregnant|baby|before
Gotta learn there's a line you wait in and you're not allowed to cut,cut,1974,1292.0,18,cross|pass|go|step|get|leave|move|walk|take|come
"Thursday was an active day with $83,590,000 of bonds brought to the new issues market",market,1966,,18,window|counter|committee|department|desk|table|division|windows|of|counters
The Ceremony of the Keys is a good example of a broadcast which requires elaborate technical arrangements to ensure ‘ continuity,continuity,1934,1543.0,18,good|perfect|that|its|success|satisfactory|the|successful|reception|silence
This sort of progress can only be achieved through full consultation from and with users at the national level,level,1933,1340.0,18,and|headquarters|centre|stage|conference|end|point|center|capital|conferences
"My mother was a teacher once, but all her life she was a ‘girl’ or a ‘ maid",maid,1961,1225.0,18,woman|young|miss|lady|child|little|mrs|lassie|lass|baby
[On telephone] I'll bring him right over... You can take my word—the kid's a cock-eyed wonder.. your mother,mother,1934,,19,own|little|wife|old|boy|money|name|show|picture|first
"The sell-off in the stock market over the past five weeks has been painful, especially for buyers who arrived late to the party",party,1944,1300.0,19,feast|market|scene|bargain|bull|markets|big|buying|new|game
Deadeye knew the score. Follow orders or leave the team,team,1948,,19,ship|service|navy|boat|gang|crew|company|ranks|room|ranch
"A group of criminals making a living from organized prostitution was referred to as a Vice-Ring, the leader of such a group being a Vice-Chief..or—with reference to the prostitutes controlled by him—a Protector",protector,1938,1390.0,19,vice|white|vicequeen|king|boss|chief|viceking|keeper|master|prostitution
Manitoba has several women law students. Probably out from their ranks will come a future ‘Madam Justice’,justice,1957,1160.0,19,x|president|z|guy|curie|butterfly|sarah|noy|devil|roland
"She was larger than lifesize: enormous buttocks and stomach, with two medium-sized watermelons for bosoms",bosom,1959,,19,breasts|hips|legs|a|arms|her|eyes|thighs|nipples|breast
In the past there were just two types of cannabis—herbal and resin,resin,1980,1382.0,19,fluid|alcoholic|extract|the|tincture|synthetic|pharmaceutical|manufactured|liquid|indian
"It was 19 seconds of madness from Fellaini involving two kicks at Sergio Agüero and a headbutt, a yellow and a straight red",red,1976,,19,left|one|right|blow|punch|arm|jab|uppercut|hook|nose
The superposed volume gratings are used to efficiently diffract incident beams along a common direction where they coherently add,add,1951,1382.0,20,form|combine|reinforce|produce|interfere|unite|build|blend|overlap|act
"I'll hear about an award-winning show..and think, ‘Oooh, brilliant, I'll watch that, what side is it on?’ Amazon, that's what side. How can that be a thing",thing,2000,,20,side|show|brilliant|good|name|bird|secret|word|prize|dog
It seems reasonable to accept in general the psychoanalytic approach..but to predict that its most useful application may well prove to be preventive rather than therapeutic; in the home and school rather than on the couch,couch,1952,1340.0,20,operating|hospital|clinic|sick|wards|consulting|bed|ward|battle|neurotic
"Michigan has a new line-up for the guards, facing backwards instead of forward on the line of scrimmage. The idea is that they can start faster on end runs than they could if they had to pull",pull,1933,,20,turn|face|get|break|start|wait|run|stop|go|swing
"Irregular patches are sometimes seen on the face and neck, the so-called chloasma uterinum (uterine mask)",mask,1940,1533.0,20,freckles|liver|freckle|or|mole|spots|moles|patches|pigmentation|mark
To a certain extent surface noise is due to irregularities in the sensitive film used for recording the track,track,1931,1470.0,20,sound|sounds|vibrations|voice|speech|picture|motion|record|wave|music
"It is not necessary to postulate a mysterious realm of abstract entities, called ‘numbers’, as the subject-matter of mathematical discourse",discourse,1931,1400.0,20,science|reasoning|study|investigation|thought|analysis|knowledge|theory|inquiry|investigations
The High Yellow Bahamian is sometimes classified as ‘ red,red,1942,,20,the|a|yellow|high|bahamian|long|bahama|large|orange|b
"While not penned by Tiffany, the jagged yet summery ‘Butterfly’ could very well be the singer's theme",theme,1935,1382.0,20,own|composition|contribution|favorite|first|choice|inspiration|best|song|offering
The jazz-loving ‘hep-cat’ who claims that the music ‘sends’ him until he is ‘ gone,gone,1946,1450.0,21,wild|all|possessed|drunk|full|crazy|off|out|carried|completely
"Since the constituents of phrases are free forms, the speaker may separate them by means of pauses",pause,1933,1426.0,21,pauses|punctuation|the|a|conjunctions|intervening|other|an|any|words
‘Do you mind if I get on top?’ she asked. ‘It's hard to breathe since I had my illness.’ ‘ Be my guest,guest,1955,,21,dear|word|soul|lady|own|blessing|little|angel|love|darling
"In the course of historical or statistical study of earthquakes in any given region it is frequently desirable to have a scale for rating these shocks in terms of their original energy, independently of the effects which may be produced at any particular point of observation. On the suggestion of Mr. H. O. Wood, it is here proposed to refer to such a scale as a ‘ magnitude",magnitude,1935,1425.0,21,seismometer|seismic|shock|seismometric|fault|quake|scale|unit|seismological|standard
"Caulophyllum, which is known among North American Indians as ‘squaw root’.., can help stimulate the uterine muscle if the baby is overdue",overdue,1939,1805.0,21,not|slow|born|to|still|too|delayed|being|coming|in
Analog machines..are enthusiastically supported by their users,user,1950,1425.0,21,users|owners|operators|customers|dealers|thousands|respective|many|purchasers|own
"I quickly referenced the cover credits, inside, to see the name of the male model with the arms that just won't quit",quit,1944,1225.0,21,stay|go|behave|be|keep|fold|get|fit|grow|let
There will be no rocking in the aisles or moshing in the pits,pit,1987,,21,seats|corners|aisles|gangways|doorways|lobby|doors|corridors|chairs|cars
Victory goes to the player who reduces his total exactly to nothing with a ‘ double,double,1935,1393.0,21,single|bull|minimum|straight|last|win|total|perfect|one|king
"When he came back, several months later, he was a new musician. He was ready",ready,1938,1175.0,22,a|no|not|now|more|able|still|playing|the|an
"Mr. Nixon's wt is 173 pounds, within the normal range, and his blood pressure was 115 over",over,1971,,22,systolic|mm|millimeters|and|to|m|at|before|on|millimetres
Preheat lamps have cathodes that must be heated electrically; this preheating process..is usually controlled by an automatic starter,starter,1939,1519.0,22,switch|device|cut|thermostat|time|relay|cutout|temperature|rheostat|circuit
While the cops were in the apartment they seized five teen-agers who came up to be put straight,straight,1946,1225.0,22,on|to|in|wise|out|through|into|under|away|next
AA [= American Association] teams enforced team limits of thirty reservists and twenty actives,active,1931,1340.0,22,recruits|players|substitutes|youngsters|young|five|new|other|men|others
[Spectator at football match:] who ate all the pies,pie,1992,1301.0,22,apples|eggs|peanuts|bread|grass|food|best|beef|sandwiches|fat
"At the end of these manœuvres, which would occupy only a few hours, it would be back in a stable, circular orbit waiting to be refuelled and serviced, and the crew could be taken down to Earth by one of the winged ‘ ferry",ferry,1951,1192.0,22,buses|busses|tenders|destroyers|liners|mother|tanks|planes|motor|cruisers
So now we've got the perfect broad. Who's first on the train,train,1962,1390.0,23,list|roll|waiting|subscription|road|honor|new|line|free|market
"Amphetamines , crystal, dexies, doublecross, hearts, meth, minibennies, pep pills, roses, speed, thrusters, truck drivers, uppers, wake-ups, whites",white,1967,,23,and|yaps|yanks|yellows|yells|yams|etc|yokels|yokes|wild
"You turn it on, press Record , then Play , and it's recording. Simple",simple,1957,1225.0,23,you|the|no|it|and|a|turn|this|if|all
"‘They were going to put out some records, and Luther went to see about it’ said Percy, ‘his “Dust my broom” was sure a killer",killer,1937,1535.0,23,hit|good|winner|scream|knockout|wow|dandy|success|knock|big
A short story read aloud was always a pleasure to the men behind the bars,bar,1951,1175.0,24,guns|lines|bars|counter|scenes|prison|gun|trenches|screen|walls
Make-up Man Senz ‘deepened’ Miss Phillips' bulgy eyes with dark brown ‘ shadow,shadow,1936,,24,make|makeup|grease|paint|burnt|chinese|eye|water|mascara|indian
"‘Network’ is a noun referring to entire social or family network as the unit of intervention... The techniques..described by Speck and Attneave..are those of assembling the social network, which they prefer to call a process of retribalization rather than ‘ networking",networking,1976,1940.0,24,network|social|group|return|net|socialization|techniques|breaking|integration|tribe
I was surprised while living in Virginia to see green peppers advertised and sold as ‘ mangoes,mango,1948,1582.0,24,mangoes|sweet|bell|chinese|red|spanish|stuffed|hot|vegetable|peppers
"When diving first became part of the Olympic program in 1904, it was little more than plain high diving from five- and ten-metre fixed platforms",platform,1938,1531.0,24,heights|springboards|platforms|spring|towers|dives|boards|ladders|take|and
"Mr H. M. Stephen..examining..parts of a Messerschmitt 109 fighter which, as a pilot officer, he shot down on Nov. 30, 1940, while operating from Biggin Hill. It was the wartime base's 600th ‘ kill",kill,1944,1225.0,24,victory|casualty|down|victim|enemy|shot|plane|crash|recorded|official
The sum of the diagonal elements of a matrix is called the trace... In group theory it is known as the character,character,1931,1350.0,24,trace|characteristic|determinant|cross|diagonal|principal|matrix|index|element|order
"In cellulose these units are linked together to give straight chains of different lengths, several of which are aligned parallel to each other,..forming a micellar bundle or micelle",micelle,1934,1901.0,25,fiber|thread|fibre|a|lamella|filament|unit|skein|band|cell
