text,target_word,year,entry_start_year,rank,top_10_words
"This bidding invariably shows a two-suiter... If he prefers the spades, he can bid two spades to indicate his preference",preference,1945,1456.0,1,preference|choice|desire|suit|hand|willingness|second|intention|wish|liking
The District owned the south side of the Inner Circle from Mansion House to South Kensington... District trains reached Uxbridge over the Metropolitan,metropolitan,1934,1410.0,1,metropolitan|great|west|g|district|london|l|line|north|midland
"The net color charge of a hadron is zero. Stated differently, a hadron is colorless (or white",white,1966,,1,white|black|monochromatic|nearly|gray|neutral|of|achromatic|has|transparent
After their day's sport..everybody will repair to Cosmo's for refreshment and songs and gags from Happy... Happy will keep the party,party,1955,1300.0,1,party|crowd|fun|ball|pot|whole|house|table|gang|tables
There is a remarkable similarity between many of the problems faced by the astronaut in ‘outer space’ and those of the aquanaut in ‘ inner,inner,1958,,1,inner|outer|the|lower|upper|middle|water|ocean|mid|deep
"Each of these quarks can come in three colours red, blue, or green",green,1975,,1,green|yellow|black|white|brown|orange|purple|violet|pink|gold
"We shall assume that there are certain sequences of three nucleotides with which an amino acid can be associated and certain others for which this is not possible. Using the metaphors of coding, we say that some of the 64 triplets make sense and some make nonsense",nonsense,1961,1612.0,1,nonsense|no|none|non|nonsence|a|sense|nonsen|neither|poor
"[In this system] spectrographic registrations formed the basis for such acoustic notions as ‘grave’ and ‘acute’, ‘compact’ and ‘ diffuse",diffuse,1952,1430.0,1,diffuse|rarefied|dispersed|loose|porous|sonorous|open|rare|dilute|extended
I concentrate somewhat more on the arts and sciences than on the professional field and much more on the doctorate than the Master,master,1960,,1,master|bachelor|degree|m|b|mastership|undergraduate|certificate|masters|mere
"A tiny minority advocates completely free exchange markets... Possibly a majority favours continued official intervention to set limits to market fluctuations... But an increasing minority favours a compromise system, variously called the crawling peg..or..the sliding",sliding,1966,,1,sliding|creeping|peg|free|stabilisation|crawling|balanced|automatic|flying|floating
The new master tape (‘son’) is retained till the next updating run in which it serves as the old master tape (‘ father,father,1961,,1,father|son|papa|dad|pa|fa|daughter|dada|mother|fader
"The enzymes..are long peptide chains formed by about twenty different kinds of amino acids, and can be considered as long ‘words’ based on a 20-letter alphabet",alphabet,1956,1475.0,1,alphabet|word|syllable|chain|basis|root|language|system|base|chemical
Define the concept opacity of a rule as follows:..A rule A→B/C–D is opaque to the extent that there are surface representations of the form (i) A in environment C–D or (ii) B in environment other than C–D... Let us refer to the converse of opacity as transparency,transparency,1971,1591.0,1,transparency|the|transparent|non|transparence|being|translucency|follows|trans|impenetrability
"The table overleaf gives the comparable quantities of each type of beverage which approximate to 9 grammes of absolute alcohol, defined by us as one alcoholic unit",unit,1976,1570.0,1,unit|equivalent|degree|dose|volume|content|fluid|beverage|glass|strength
Direct governmental support of medical students and medical schools were vigorously opposed at one time or another by organized medicine,medicine,1966,1225.0,1,medicine|labor|medical|physicians|groups|and|bodies|labour|workers|practitioners
The entire aggregation of elements is termed an electric network... Each junction point of two or more branches is termed a node,node,1943,1391.0,1,node|point|pole|junction|contact|neutral|branch|potential|cell|joint
An example of the actual printed output which optical scanners are required to read,read,1962,,1,read|produce|handle|deal|examine|decipher|make|do|perform|sort
"Talk about one thing, talk about an other; But ef you talk about me, I'm gwain to talk about your mother",mother,1934,,1,mother|father|wife|own|brother|ma|fodder|sister|mudder|and
"Why should one group orient predominantly ortho and para, and another predominantly meta",meta,1938,1876.0,1,meta|the|para|me|meio|ortho|peri|in|ana|meso
They [ sc. children] want to eat savoury things most of all; but there are certain ‘in’ sweet-stuffs and a very great many ‘ out,out,1966,1300.0,1,out|in|without|outside|on|of|between|outs|sweet|with
"The director asked: ‘Aren't you going to study your lines?’ ‘I know what it says,’ replied Bickford. ‘I'll turn to the gang and say, “We'll head 'em off at Eagle Pass”.’",pass,1939,1393.0,1,pass|rock|river|bend|creek|gap|gorge|bridge|gulch|lake
"These are all harmless laxatives, useful if your normal diet produces insufficient bulk",bulk,1940,1440.0,1,bulk|bowel|waste|residue|intestinal|laxative|elimination|results|gas|fecal
"An instrument believed to be wholly new in the orchestra pit, the musical saw",saw,1931,,1,saw|director|instrument|glasses|critic|world|possibilities|telephone|conductor|wonder
Never in the field of human conflict was so much owed by so many to so few,few,1941,,1,few|many|much|great|small|little|single|one|simple|large
The term ‘insecurity’ and its correlative ‘desire for security’ appear extensively in child development literature... We need methods by which we can discriminate between the relatively secure and the relatively insecure,insecure,1935,1649.0,1,insecure|unsafe|secure|unstable|insecures|unsecure|precarious|in|exposed|dangerous
There exist equally interesting relationships between odours and animal behaviours on a different and more profound level,level,1933,1340.0,1,level|plane|scale|basis|physiological|psychological|plan|biological|order|mental
Parker made an error before the game was an inning old,old,1967,,1,old|and|long|in|older|over|or|cid|o|ola
The bush of the jack will be connected to the exchange battery via the plug inserted in one of the other jacks with which it is connected in multiple,multiple,1943,1595.0,1,multiple|the|series|parallel|a|common|pairs|order|its|such
"Hill..was representing a Germany united for Olympic purposes, which won three gold and a silver",silver,1960,,1,silver|number|dozen|bronze|large|like|few|second|great|third
"One popular model has red, white and blue quark triplets. This obviously American model can be expected to be followed by models with other patriotic colors or with equal representation of white, black and yellow",yellow,1975,,1,yellow|red|tan|blue|brown|pink|green|gold|other|the
"For many years, the British viewer's choice was limited to the B.B.C.'s single, noncommercial channel. Since 1955 he has had a second, the commercial service called Independent Television and known to all as ‘The Other Side",side,1961,,1,side|one|fellow|service|way|channel|station|voice|line|company
Is that Lesley Joseph? In't there nowt on the other side,side,1961,,1,side|end|chaps|hand|road|way|cheek|one|lad|chap
Neither of you need worry about the dishes... I'll wash and Grace will wipe,wipe,1943,,1,wipe|dry|iron|put|set|do|clear|help|polish|get
"Numbers at one end of a permitted range can be detected by adding a constant and testing the sign, and then the result of the discrimination may be used to operate a multiway switch",switch,1951,1597.0,1,switch|selector|key|relay|device|signal|stop|or|transmitter|circuit
A heading dog..goes wide round sheep so as not to disturb them and make them go faster. This curve or sweep is called a cast,cast,1933,1300.0,1,cast|circle|round|circuit|quarter|turn|head|curve|beat|sweep
"We feel that this change will be sufficient to discourage ‘hackers’, although it is obviously insufficient to protect a node against a determined and malicious attack",attack,1973,1646.0,1,attack|assault|enemy|opponent|attempt|foe|onslaught|invasion|assailant|effort
"One can make the three-quark system totally antisymmetric by introducing a new degree of freedom for the quarks. We paint them red, green",green,1975,,1,green|and|yellow|blue|white|for|say|black|violet|but
This heat influx resulted in widespread metamorphism and establishment of an amphibolite-grade infrastructure (Kiokee Belt) and a greenschist-grade superstructure,superstructure,1937,1626.0,1,superstructure|super|upper|suprastructure|extrastructure|structure|outcrop|infrastructure|intrastructure|overstructure
Two chartered sleeping cars carried the men across the United States like royalty—and nobody ever had to take an upper,upper,1938,1789.0,1,upper|extra|oath|order|inventory|observation|inferior|overcoat|encore|interest
"Assume you have three sets of quarks, each an SU(6) sextet but distinguished from one another by some attribute I do not know, say red, white and blue",blue,1966,1300.0,1,blue|black|green|yellow|grey|pink|purple|violet|brown|gray
"As Opie says about her S-and-M practice today: ‘I've worn out any desire for being a bottom. If I play now, I'm the top",top,1979,,1,top|first|best|one|whole|s|bottom|ball|only|middle
He would soon be driving around in a family eight or ten,ten,1931,,1,ten|nine|a|twelve|four|ton|six|sixteen|something|more
A doctor..does not have to give reasons for his refusal to accept a patient on his list,list,1949,1604.0,1,list|staff|waiting|books|own|private|visiting|first|doorstep|hands
I've never met any of his—interests. Certainly not this girl. I dunno her from a bar of soap,soap,1938,,1,soap|chocolate|laundry|castile|music|soup|yellow|hard|gold|cast
Where there is speed and goal-scoring power in the middle and down the wings every effort should be made to exploit them to the full by keeping the game as open,open,1934,,1,open|fast|close|free|simple|loose|short|long|rough|far
‘Why doesn't she marry the child's father?’.. ‘It's my belief she doesn't know him from a bar of soap.’,soap,1938,,1,soap|chocolate|laundry|castile|yellow|cast|music|hard|soup|brown
I went..to meet some people who had a development problem they wanted to drop in our laps,lap,1962,,1,lap|hands|laps|office|way|ears|box|ear|mail|company
"The big one is the bass drum, and that round black case is what they call the snare",snare,1938,,1,snare|cymbals|bass|tympanum|cymbal|triangle|big|kettle|kettledrum|tympani
Recently the Press recorded the invention of a calculating machine... They called it a ‘ brain,brain,1934,,1,brain|machine|calculating|comptometer|mechanical|lightning|mental|brainless|calculator|slide
The domestic implications of this functional ideology were not lost upon the peers who shared its universe of discourse,discourse,1931,1400.0,1,discourse|desire|thought|discussion|the|values|desires|ideas|discursive|experience
In converted liners called AMCs..whose tiny guns left them sitting ducks for the U-boat wolf packs,pack,1942,1228.0,1,pack|packs|to|and|that|in|when|the|of|who
"One might reasonably expect that Hollywood would adjust its approach and reduce the levels of sex, violence and gutter language so that fewer films would earn the ‘R’ rating",rating,1934,1534.0,1,rating|of|mark|grade|classification|ratings|and|designation|marks|or
"They are anxious to make a ‘connection’, ‘score’ or ‘ hit",hit,1951,1450.0,1,hit|get|put|land|win|make|register|beat|connect|score
"Upper-class students will tend to be found in the academic or collegiate subcultures, with few in the vocational",vocational,1960,1652.0,1,vocational|professional|technical|scientific|industrial|graduate|lower|secondary|elementary|commercial
Modern physics observes particles (such as electrons) and antiparticles (like positrons) which form a symmetric pair where each has an identical mass but opposite charge,charge,1958,1225.0,1,charge|charges|electric|sign|electrical|polarity|signs|electricity|electrification|polarities
We are persuaded that this greatest new rose of our time should be named for the world's greatest desire: Peace,peace,1944,1160.0,1,peace|the|a|for|love|happiness|beauty|that|universal|america
"Generally speaking, the partners are concordant when their genotype is the same, as in identical twins, but when their genotype may be different, as in fraternal twins, the partners are more often discordant",discordant,1932,1393.0,1,discordant|antagonistic|at|in|not|than|concordant|divergent|different|mutually
In the 1924 Land's End one of these cars..won a silver medal and four other Palladiums secured ‘ golds,gold,1945,,1,gold|bronze|honorable|first|golds|honourable|silver|honors|golden|the
"Questioned on a press report that ‘a close adviser to President Truman’ was predicting Johnson's resignation, White House Press Secretary Charles Ross issued a perfunctory ‘ no comment",comment,1950,1400.0,1,comment|statement|information|answer|such|confirmation|reply|basis|knowledge|authority
It is normally stated in the form of rules which may be applied to one of the pair—an input —altering it to produce the other—an output,output,1961,1839.0,1,output|out|outgo|outpu|outflow|outout|outlet|outgoing|e|efflux
"I'll stake my pension on a conviction. In fact, if the lad's any sense he'll hold up his hand and plead",plead,1959,1275.0,1,plead|take|confess|own|say|tell|be|go|make|give
"Once an RPC client makes a request, it must wait for a reply",reply,1970,1560.0,1,reply|turn|definite|decision|favorable|long|full|certain|regular|place
"‘I'm out for the guilty party that's got a leak in my office that I can't stop up.’ ‘Well,..why don't you put a detective on the job?’..‘Detective!..Hell! What I need is a plumber.’",plumber,1972,1385.0,1,plumber|carpenter|cork|cement|detective|good|burglar|rubber|mechanic|rat
"These dinners..cost 6 1/2 d. to 7 d. each, and consist of fish and meat, two vegetables, and a pudding",pudding,1934,1287.0,1,pudding|sweet|dessert|tart|pint|small|large|light|piece|desert
He seems to be taking quite an interest in you... You'd better watch your step,step,1934,,1,step|steps|p|man|actions|eye|manners|husband|self|chances
Families may soon be enjoying a tipple at the bar to make their parties held in the community centre go with a swing,swing,1976,1400.0,1,swing|bang|snap|greater|little|punch|better|zip|dash|vim
"Before there were any dialect surveys in the United States, it was generally believed that there were two main dialects, Yankee (i.e. northern) and southern",southern,1935,,1,southern|southerner|south|southron|virginian|dixie|pennsylvania|carolina|the|sou
"The forms and methods of economic management, both micro and macro",macro,1974,1933.0,1,macro|macroscopic|mega|megascopic|megalo|grand|megal|macros|ma|large
"One type of [adrenotropic] receptor is associated with most of the excitatory functions and with at least one of the inhibitory functions (intestine). The other type is associated with most of the inhibitory functions and with one..excitatory function (myocardium)... Because of the opposite effects..the customary signs, E (excitatory) and I (inhibitory) cannot be applied. Therefore, for convenience they have been designated as the alpha adrenotropic receptors and the beta",beta,1948,1400.0,1,beta|alpha|gamma|delta|omega|theta|sigma|zeta|b|deta
"Although the art of interpreting air photographs had been developed quite a long way in the First World War, in the summer of 1939 there was precisely one experienced interpreter",interpreter,1950,1384.0,1,interpreter|air|pilot|officer|and|photographic|man|specialist|photographer|staff
The objective expert inquiry..was swamped..when the advocates of easy money climbed aboard,aboard,1936,1393.0,1,aboard|on|into|upon|over|in|to|the|up|all
Makers of new software games answer a series of questions to determine whether their products contain any ‘objectionable content’; an RSAC panel..then assigns each game a rating,rating,1934,1534.0,2,number|rating|serial|grade|class|code|classification|symbol|numerical|new
"Dave wandered into my office, mumbling about a hiccup in the Unix accounting system",system,1956,1580.0,2,department|system|room|for|office|machine|and|rooms|service|that
With its 49 mm filter thread..and a price of £99.90 it should be a quick mover,mover,1971,1385.0,2,seller|mover|selling|and|moving|move|turn|buyer|turnover|favorite
"To describe the strong force we need three ‘colours’—three different types of charges, usually designated ‘red’, ‘green’ and ‘ blue",blue,1966,1300.0,2,white|blue|yellow|violet|black|purple|brown|amber|gold|neutral
The use of acoustic energy to perform all those functions in hydrospace for which electromagnetic energy is employed in aerospace,aerospace,1959,1955.0,2,the|aerospace|air|space|radio|a|wireless|electrospace|radiospace|electromagnetic
Although some lesbians see to it that in virtually all their relationships they are dominant and some lesbians prefer always to be submissive,submissive,1969,1572.0,2,dominant|submissive|the|in|subordinate|dominated|subject|on|subservient|ruled
"The name ‘hydroxyl’ has long denoted the group OH. In organic contexts it is undoubtedly correct; but the expression ‘hydroxyl ion’ is very frequently used, although possibly less logical than ‘ hydroxide",hydroxide,1955,1851.0,2,hydroxyl|hydroxide|hydrogen|water|oh|hydroxy|ionized|ion|hydrion|oxygen
"Baseball is not my game, In fact, I think it's pretty lame",lame,1972,,2,tame|lame|slow|rough|tough|bad|poor|plain|hard|rotten
Fred Harrison failed to win any..prize money in the Ace Bowling Centre's men's open five pin tournament but he..included a perfect 450 game in his 10-game string,string,1961,,2,total|string|score|effort|series|average|record|set|totals|performance
"Casting a wary eye back to the dystopias depicted by Wells and Huxley, we can picture a society in which highly taxed ‘alphas’ peer down with contempt at modestly taxed ‘betas’, who in turn peer down with contempt at heavily subsidized ‘ gammas",gamma,1932,1425.0,2,gammas|gamma|betas|beta|gam|sigmas|gams|lambdas|alphas|omicrons
"Ford, at the very last, was doing something right. Most of the polls showed he was closing fast on Jimmy Carter, who was limping badly down the stretch",stretch,1949,1541.0,2,home|stretch|homestretch|last|track|road|long|course|back|line
"It was a lot for a picture frame, but your grandmother had some hats..which were seventy-five cents too. So she asked the gypsy woman if she'd like to trade",trade,1949,1539.0,2,buy|trade|have|sell|take|see|change|exchange|look|make
One substance may affect the entrance of another by competing for the substance which acts as a carrier,carrier,1936,1395.0,2,solvent|carrier|common|vehicle|medium|buffer|barrier|key|link|base
"Now to illustrate this empirical analysis of meaning at the phonetic, morphological, syntactical, and semantic levels",level,1935,1340.0,2,levels|level|stages|points|stage|or|sides|standpoints|ends|aspects
Most golf clubs have a share of ‘ear-bashers’ as the Aussies call the type who verbally replay their strokes ad nauseum at the ‘ nineteenth,nineteenth,1948,,2,tee|nineteenth|tees|bunker|teeing|locker|putting|hole|eighteenth|fourth
"The motor torque was found to be nearly constant over a wide range of speeds, which is predicted for a mechanism in which energy from the ion gradient is used to apply force to the rotor",rotor,1976,1873.0,2,moving|rotor|motor|ion|driving|movable|piston|mechanism|electrons|armature
"But Matthew makes it more plain than Luke that we are not merely dealing with what Schweitzer called an interimsethik , a scale of values only appropriate to a world which is shortly to go up in smoke",smoke,1933,,2,flames|smoke|flame|a|fire|the|conflagration|an|ashes|catastrophe
"Two hundred thousand dollars is not too much to have paid for the pleasure of having endowed the planetary world with a new star, and the earth with a second satellite",satellite,1936,1520.0,2,moon|satellite|sun|venus|planet|comet|edition|and|luminary|one
Web tablets..are like laptops without keyboards and can be scribbled upon with electronic pens,pen,1972,1350.0,2,ink|pen|tools|pencil|pens|accuracy|or|pencils|negative|ease
The doctor was free to accept or reject anyone applying to go on his list,list,1949,1604.0,2,staff|list|ship|team|expedition|boat|case|trip|service|rounds
"If a man spoke rather loudly..keeping his vowels open, then he was an Upper. If he attempted all this and just failed, then he was a Middle",middle,1955,,2,lower|middle|mid|low|south|central|half|middler|southerner|down
"In return we get syncopated music, and what to do to it—the Baleta..the Twinkle..the Missouri Walk",walk,1937,,2,waltz|walk|stomp|mule|and|slide|drag|shuffle|rag|swing
There should be an open broadcasting authority to take responsibility for the fourth television channel,channel,1952,1387.0,2,station|channel|development|broadcasting|broadcast|transmitter|system|and|license|circuit
All of these terminals may act as more or less sharply resonant systems... They may..be thought of as electromagnetic analogues of the Helmholtz resonator,resonator,1936,1864.0,2,resonators|resonator|resonance|double|resonating|resonant|and|organ|theory|nodal
Apparently anyone who believes in genetic racial differences is a ‘racist’... I suppose by analogy that anyone who believes in genetic sex differences is a ‘ sexist,sexist,1949,1949.0,2,feminist|sexist|sexualist|sexologist|womanist|sextist|sex|bisexist|femaleist|genist
Sox first baseman Paul Konerko bobbled a grounder to allow Nixon to reach,reach,1932,,2,score|reach|cross|tally|get|make|advance|come|go|register
"The effect of gluon emission or absorption, then, is to change the identity of a quark, for instance from a red quark to a green",green,1975,,2,blue|green|yellow|violet|red|white|purple|bluish|pink|black
Our winter so far has been mild with about one week of a cold snap. It was around 20 degrees above,above,1944,,2,below|above|for|and|the|one|at|on|most|here
They were all angry young men..cocking a snook at aesthetic and social pretensions—prophets of artistic anarchy,anarchy,1952,1539.0,3,and|revolt|anarchy|revolution|democracy|freedom|salvation|righteousness|liberty|culture
President Amin's jet airliner was poised last night to take off for Uganda..on a whisky run,run,1961,1475.0,3,smuggling|and|run|running|expedition|trip|mission|hunt|flight|survey
The share price..is vulnerable to even the most modest of bear rumour and.. the downside substantially exceeds the upside,upside,1961,1611.0,3,up|ups|upside|upward|upturn|amount|rise|buying|normal|recovery
"With due respect to Southern..the established tradition of ‘geographic’ naming of transfer techniques (‘Southern’, ‘Northern’) is continued; the method described in this manuscript is referred to as ‘ Western",western,1981,,3,southern|northern|western|eastern|northeastern|transfer|southerly|southeastern|north|northwestern
It is a good idea to open the bottle about an hour before pouring. This is known as letting the wine ‘ breathe,breathe,1950,1300.0,3,come|ripen|breathe|break|settle|age|get|fine|stand|bloom
A more selective system of Customs questioning of passengers..is provided for in the finance bill published yesterday... Those who have anything to declare will go through a ‘red’ channel... Those who have nothing to declare will pass through a ‘ green,green,1968,,3,white|blue|green|yellow|black|pink|brown|violet|bine|gray
"They're a miserable lot of sods. If that is an example of the spirit of the people of Windsor, they can keep",keep,1956,,3,go|have|keep|never|all|get|take|be|just|do
"Marxism considers all ideology, all theory, to be a reflection, an epiphenomenon, of economic actuality, a superstructure on a materialistic base",base,1933,1335.0,3,foundation|basis|base|substratum|substructure|economic|and|social|ground|structure
"Overworked, terminally exhausted and burnt out by city living, many thirty-somethings and their families are ‘greenshifting’—foresaking urban routine in pursuit of a slower pace",pace,1933,1300.0,3,tempo|life|pace|and|rhythm|but|living|pulse|gait|way
"Gameplay is noticeably smoother; piloting your fire-breathing dragon through the skies, you wipe out endless demons with the help of your crossbow, dragonbreath and other magical",magical,1972,1492.0,3,magic|weapons|magical|devices|charms|fire|mystic|instruments|implements|equipment
"You can be up to your boobies in white satin, with gardenias in your hair and no sugar cane for miles, but you can still be working on a plantation",plantation,1956,1425.0,3,farm|salary|plantation|ranch|job|pair|cotton|sugar|newspaper|new
Orders to various parts of the machine..can be expressed conveniently as numbers in some arbitrary code,code,1946,1387.0,3,system|scale|code|units|unit|language|notation|form|or|manner
The worst burger of all was the half-pound cheeseburger from Julie's Pantry,pantry,1948,1325.0,3,kitchen|room|pantry|own|home|hand|shop|house|store|native
"‘Francis, you know Al Hibbler.’ ‘Why, that's my man",man,1945,,3,brother|old|man|name|cousin|friend|husband|boy|father|partner
"The courts do not use this cost-based test to establish predatory pricing. Rather, below-cost prices create a presumption of predation",predation,1958,1500.0,3,predatory|unfair|predation|a|unfairness|intent|price|the|an|pricing
"The usual routine is to grab someone with junk on him, and let him stew in jail until he is good and sick",sick,1951,,3,ready|hungry|sick|tired|sore|willing|sorry|scared|broke|ripe
"For the New Critics, a writer never speaks for himself but only through an assumed persona, a mask",mask,1948,1533.0,3,character|sort|mask|fictitious|mere|literary|kind|type|chorus|mouthpiece
